{
  "schema_version": "0.1",
  "external_id": "multi_turn_base_0",
  "domain": "gorilla_file_system",
  "turns": [
    {
      "sequence": 0,
      "type": "user_message",
      "content": "Move final_report.pdf into a new temp directory."
    },
    {
      "sequence": 1,
      "type": "user_message",
      "content": "Search the moved file for budget analysis."
    }
  ],
  "setup": {
    "type": "inline",
    "payload": {
      "GorillaFileSystem": {
        "root": {
          "document": {
            "final_report.pdf": {
              "type": "file"
            }
          }
        }
      }
    }
  },
  "involved_classes": ["GorillaFileSystem", "TwitterAPI"],
  "data_classification": "synthetic",
  "display_label": "Synthetic / BFCL-derived",
  "provenance": {
    "source_record_id": "multi_turn_base_0",
    "source_revision": "ea13468e4423454d0c213704fb87cf7cb3990433",
    "retrieved_at": "2026-09-01T16:45:00Z",
    "license": "Apache-2.0",
    "attribution": "Berkeley Function Calling Leaderboard (BFCL) v3 Base. Gorilla, UC Berkeley.",
    "raw_questions_sha256": "sha256:a3f1a3f1a3f1a3f1a3f1a3f1a3f1a3f1a3f1a3f1a3f1a3f1a3f1a3f1a3f1a3f1",
    "raw_possible_answers_sha256": "sha256:b7c2b7c2b7c2b7c2b7c2b7c2b7c2b7c2b7c2b7c2b7c2b7c2b7c2b7c2b7c2b7c2"
  }
}
